headline,snippet,web_url,lead_paragraph
{u'main': u'Liberals Hold Onto Power In Close Election in Canada'},"Prime Minister Paul Martin and his Liberal Party survived a strong Conservative challenge on Monday to retain power, but they lost their majority in the House of Commons after the most rancorous election campaign in nearly a generation.    Stephen...",https://www.nytimes.com/2004/06/29/world/liberals-hold-onto-power-in-close-election-in-canada.html,"Prime Minister Paul Martin and his Liberal Party survived a strong Conservative challenge on Monday to retain power, but they lost their majority in the House of Commons after the most rancorous election campaign in nearly a generation. Stephen Harper, the Conservative Party leader who called for tax cuts and more military spending, hoped to begin a sea change in Canadian politics, but his campaign stalled in its final days. Urban voters feared that his victory could jeopardize social programs and bring to power social conservatives who opposed abortion and gay rights."
{u'main': u'Business in Canada; The Bright Economic Outlook Has Dimmed'},"OTTAWA An economist from a third world country, in Vancouver for a United Nations conference, suggested the other day that this nation's ""vast resources"" must make many Canadians feel complaisant in a world full of need. Canadians reacted wryly to...",https://query.nytimes.com/gst/abstract.html?res=9500E2DD163DE034BC4952DFB066838D669EDE,"OTTAWA An economist from a third world country, in Vancouver for a United Nations conference, suggested the other day that this nation's ""vast resources"" must make many Canadians feel complaisant in a world full of need. Canadians reacted wryly to the comment."
{u'main': u'TRIAL IN BOMBING IN WISCONSIN SET; Fled to Canada'},"Karleton Lewis Armstronghometown boy, former Boy Scout and onetime crew-cut high-schooler-strode into a heavily guarded Dane County Circuit Court here last Tuesday.-afternoon, raised his right fist in a ""power to the people"" salute, and sat down w...",https://query.nytimes.com/gst/abstract.html?res=9F02E2DE133BE53ABC4D51DFB5668388669EDE,"Karleton Lewis Armstronghometown boy, former Boy Scout and onetime crew-cut high-schooler-strode into a heavily guarded Dane County Circuit Court here last Tuesday.-afternoon, raised his right fist in a ""power to the people"" salute, and sat down with his lawyer at the defendant's table."
"{u'main': u""YUGOSLAVIA BACKS WEST PEACE MOVE; HITS AT SOVIET PLAN; Djilas in U. N. Supports U. S.-British Proposal for the Observance of Charter NOT FOR SOME PROVISIONS Canadian Demands Moscow Withdraw 'Fifth Columns' -New Zealand Also Critical ASSAIL RUSSIA YUGOSLAVIA BACKS WEST PEACE MOVE""}","LAKE SUCCESS, Nov. 15 -Milovan Djilas, Yugoslav representative to the United Nations, said today that the Soviet proposals for a Big Five non-aggression pact ""sound rather ironical"" when contrasted with the Soviet Union's pressure against the Tito...",https://query.nytimes.com/gst/abstract.html?res=9E03E6DF153BE23BBC4E52DFB7678382659EDE,"LAKE SUCCESS, Nov. 15 -Milovan Djilas, Yugoslav representative to the United Nations, said today that the Soviet proposals for a Big Five non-aggression pact ""sound rather ironical"" when contrasted with the Soviet Union's pressure against the Tito Government."
"{u'main': u""CARDINALS SEEKING CURB UPON PONTIFF; Reported Desirous of More Independence Than They Had Under Pius XI NON-ITALIAN MOVE LINKED Cardinal O'Connell Believed to Be in Running for the Election as Pope Cites Plus's Supremacy Would Curb Absolutism Canadian Seems Favorite""}","VATICAN CITY, Feb. 24.--To an American commentator observing the preliminaries of the forthcoming papal election--who only yesterday, so to speak, was watching and writing about the results of the last Presidential election in the ......",https://query.nytimes.com/gst/abstract.html?res=9D04E3DD133CE73ABC4D51DFB4668382629EDE,"VATICAN CITY, Feb. 24.--To an American commentator observing the preliminaries of the forthcoming papal election--who only yesterday, so to speak, was watching and writing about the results of the last Presidential election in the ..."
"{u'main': u""M'CAULEY ARRESTED ACCUSED OF LARCENY; International Mercantile's ex-President Wanted in Canada.""}","McCauley, Thomas N., held, larceny from Int. Merc. Company...",https://query.nytimes.com/gst/abstract.html?res=9800E2D81230E132A25752C3A96E9C946597D6CF,
{u'main': u'FREE TRADE WITH CANADA.; R.G. Hervey Urges Upon Senator Fairbanks the Advantages of a Broad Reciprocity Treaty.'},"Robert G. Hervey, the President of a railroad company in Nova Scotia, has written the following letter to Senator Fairbanks, a member of the commission appointed to adjust the differences between the United States and Canada, urging the abolishmen...",https://query.nytimes.com/gst/abstract.html?res=9404E2D91030E333A25750C0A9649D94699ED7CF,"Robert G. Hervey, the President of a railroad company in Nova Scotia, has written the following letter to Senator Fairbanks, a member of the commission appointed to adjust the differences between the United States and Canada, urging the abolishment of any customs tariff between the two countries, except upon goods imported from other countries by Canada and exported to the United States, or vice versa."
{u'main': u'THE TROOPS FOR CANADA.'},"We are about to send a small army to Canada. This is just one of those steps upon which it is most difficult to pronounce an opinion, because we cannot suppose we have all the facts before us. In the present disturbed state of America......",https://www.nytimes.com/1861/07/02/news/the-troops-for-canada.html,"We are about to send a small army to Canada. This is just one of those steps upon which it is most difficult to pronounce an opinion, because we cannot suppose we have all the facts before us. In the present disturbed state of America..."
"{u'main': u""FOUR DAYS LATER FROM EUROPE.; ARRIVAL OF THE BALTIC. ICEBERGS IN 43[degree]. NO NEWS OF THE PACIFIC. THE APPROACHING PEACE CONFERENCES IN PARIS Speculations on thier Probable Result. AUSTRIA'S PROPOSALS TO THE GERMANIC DIET. THE ANGLO-AMERICAN DIFFICULTY. TROOPS ORDERED TO CANADA THE NEW BRITISH LOAN. Demolition of Fort Nicholas at Sebastopol. COTTON STEADY. BREADSTUFFS IN BETTER DEMAND. Consols 901-2 a 90 5-8"", u'kicker': u'2'}","The United States Mail steamer Baltic, from Liverpool, Wednesday, 20th February, arrived at her dock about 11 o'clock yesterday morning. Mr. WILLIAM MOORE, passenger, died on the 10th, on the voyage to Liverpool. The Africa arrived at Liverpool, 8...",https://query.nytimes.com/gst/abstract.html?res=9B01E7D7103DE034BC4D53DFB566838D649FDE,"The United States Mail steamer Baltic, from Liverpool, Wednesday, 20th February, arrived at her dock about 11 o'clock yesterday morning. Mr. WILLIAM MOORE, passenger, died on the 10th, on the voyage to Liverpool. The Africa arrived at Liverpool, 8:05 morning of Monday, the 18th. She brings no intelligence of the Pacific."
"{u'main': u'Many Canadian Aboriginals See No Compromise on Oil Sands Pipeline', u'print_headline': u'Many Canadian Aboriginals See No Compromise on Oil Sands Pipeline'}","Just a few miles from the spot where Enbridge Inc plans to build a massive marine terminal for its Northern Gateway oil pipeline, Gerald Amos checks crab traps and explains why no concession from the company could win his support for the project....",https://www.nytimes.com/reuters/2014/04/21/world/americas/21reuters-pipeline-aboriginals.html,"Just a few miles from the spot where Enbridge Inc plans to build a massive marine terminal for its Northern Gateway oil pipeline, Gerald Amos checks crab traps and explains why no concession from the company could win his support for the project."
{u'main': u'Canada Port Gains as Ice Diminishes'},"Here on the edge of Canada's tree line, where polar bears prowl the tundra under the dancing lights of the northern sky, a Barbadian flag vessel was at port one recent evening, its crew sweeping aside snow to fill its holds with grain for shipment...",https://www.nytimes.com/2000/11/03/business/canada-port-gains-as-ice-diminishes.html,"Here on the edge of Canada's tree line, where polar bears prowl the tundra under the dancing lights of the northern sky, a Barbadian flag vessel was at port one recent evening, its crew sweeping aside snow to fill its holds with grain for shipment direct to Europe. While politicians debate the validity of global warming, some shippers are voting with their boats, quietly shifting marine routes to Churchill, Canada's northernmost industrial harbor. After decades of ignoring the only major port on the Hudson Bay because of ice hazards, shippers are finding that the retreating ice cover is putting Churchill on the map. By docking at this sub-Arctic outpost of 1,100 residents, oceangoing ships benefit from rail links to the prairie heartlands of Canada and the United States, the world's largest wheat exporting nations. And their business is much to the benefit of Omnitrax Inc., the Denver-based company that bought the port and access railroad in 1997."
{u'main': u'Canada Seeks Phone Rivalry'},"More than a decade after barriers to competition began to come down in Canada's telephone industry, politicians and regulators are venting their displeasure at how little has been accomplished.    In contrast to the United States, where AT&T was b...",https://www.nytimes.com/2003/04/22/business/canada-seeks-phone-rivalry.html,"More than a decade after barriers to competition began to come down in Canada's telephone industry, politicians and regulators are venting their displeasure at how little has been accomplished. In contrast to the United States, where AT&T was broken up long ago and curbs placed on the new regional operating companies, regulators in Canada have taken a softer approach, seeking to encourage competition without destabilizing the entrenched incumbents. The hope has been that new entrants would gain market share by building networks of their own, and, with some help from regulators, by gaining access to existing lines at reasonable cost."
{u'main': u'Flight To Canada; Canada'},"Reed, Ishmael: Flight to Canada revd by Jerome Charyn; Reed por...",https://query.nytimes.com/gst/abstract.html?res=9E00E3D9173DE034BC4152DFBF66838D669EDE,
"{u'main': u'U.S. Equestrian Team Wins Nations Cup Jumping at Harrisburg Horse Show; 3 AMERICANS GIVE FAULTLESS RIDES Canadian Team Finishes in Second Place Chile, Ireland Far Behind', u'kicker': u'1'}","HARRISBURG, Pa., Oct. 21 The strength and depth of the United States Equestrian Team brought victory tonight in the Nations Cup event in the Pennsylvania National Horse Show....",https://query.nytimes.com/gst/abstract.html?res=9D0DE6D9143CE43BBC4A51DFB667838D679EDE,"HARRISBURG, Pa., Oct. 21 The strength and depth of the United States Equestrian Team brought victory tonight in the Nations Cup event in the Pennsylvania National Horse Show."
"{u'main': u'New Nations: How They Came of Age; DEMOCRACY IN THE DOMINIONS. By Alexander Brady. 475 pp. Toronto, Canada: The University of Toronto Press. $4.25.'}","ONLY those who have taken on the task of trying to understand a nation other than their own will thoroughly appreciate the immense amount of work that has gone into Professor Brady's admirable comparative study of Canada, New Zealand, Australia an...",https://query.nytimes.com/gst/abstract.html?res=9C02E1DD113EEF33A25757C2A96E9C946693D6CF,"ONLY those who have taken on the task of trying to understand a nation other than their own will thoroughly appreciate the immense amount of work that has gone into Professor Brady's admirable comparative study of Canada, New Zealand, Australia and South Africa."
"{u'main': u""TRADE WITH CANADA.; WHAT MINISTER FOSTER SAYS OF THE M'KINLEY BILL.""}","OTTAWA, Ont., Sept. 13. -- The Hon. George E. Foster, Minister of Finance, speaking to a TIMES correspondent to-day regarding the effect of the McKinley bill on Canada, said: ""In the measure as it passed the Senate there is little that is calculat...",https://query.nytimes.com/gst/abstract.html?res=9C07EFDD1239E033A25757C1A96F9C94619ED7CF,"OTTAWA, Ont., Sept. 13. -- The Hon. George E. Foster, Minister of Finance, speaking to a TIMES correspondent to-day regarding the effect of the McKinley bill on Canada, said: ""In the measure as it passed the Senate there is little that is calculated to favor Canadian trade, while the general trend is in the line of prohibiting Canadian products from the American markets."
{u'main': u'The Militia of Canada.'},"A year ago we laid before our readers a summary, derived from official sources, of the numbers, equipment and general resources of the local military force of Canada. We have now before us the Provincial Militia Report for the past year, and a few...",https://www.nytimes.com/1864/03/20/news/the-militia-of-canada.html,"A year ago we laid before our readers a summary, derived from official sources, of the numbers, equipment and general resources of the local military force of Canada. We have now before us the Provincial Militia Report for the past year, and a few facts may be gathered from it, not altogether without interest."
"{u'main': u'Many Canadian Aboriginals See No Compromise on Oil Sands Pipeline', u'print_headline': u'Many Canadian Aboriginals See No Compromise on Oil Sands Pipeline'}","Just a few miles from the spot where Enbridge Inc plans to build a massive marine terminal for its Northern Gateway oil pipeline, Gerald Amos checks crab traps and explains why no concession from the company could win his support for the project....",https://www.nytimes.com/reuters/2014/04/21/world/americas/21reuters-pipeline-aboriginals.html,"Just a few miles from the spot where Enbridge Inc plans to build a massive marine terminal for its Northern Gateway oil pipeline, Gerald Amos checks crab traps and explains why no concession from the company could win his support for the project."
{u'main': u'Canada Port Gains as Ice Diminishes'},"Here on the edge of Canada's tree line, where polar bears prowl the tundra under the dancing lights of the northern sky, a Barbadian flag vessel was at port one recent evening, its crew sweeping aside snow to fill its holds with grain for shipment...",https://www.nytimes.com/2000/11/03/business/canada-port-gains-as-ice-diminishes.html,"Here on the edge of Canada's tree line, where polar bears prowl the tundra under the dancing lights of the northern sky, a Barbadian flag vessel was at port one recent evening, its crew sweeping aside snow to fill its holds with grain for shipment direct to Europe. While politicians debate the validity of global warming, some shippers are voting with their boats, quietly shifting marine routes to Churchill, Canada's northernmost industrial harbor. After decades of ignoring the only major port on the Hudson Bay because of ice hazards, shippers are finding that the retreating ice cover is putting Churchill on the map. By docking at this sub-Arctic outpost of 1,100 residents, oceangoing ships benefit from rail links to the prairie heartlands of Canada and the United States, the world's largest wheat exporting nations. And their business is much to the benefit of Omnitrax Inc., the Denver-based company that bought the port and access railroad in 1997."
{u'main': u'Canadian Premier Is Shifting Economic Goals; Take-over Date Vague Diversity of Capital Urged Canadian Shifts His Economic Goalsl Town Bought'},"VANCOUVER, British Co lumbia-Whether it is from confidence that springs from exercising high office or from a change of heart, Premier David Barrett is adjudged here a more ""relaxed radical"" than he appeared on taking over British Columbia's gover...",https://query.nytimes.com/gst/abstract.html?res=9900E2DA1338EF3ABC4153DFB1668388669EDE,"VANCOUVER, British Co lumbia-Whether it is from confidence that springs from exercising high office or from a change of heart, Premier David Barrett is adjudged here a more ""relaxed radical"" than he appeared on taking over British Columbia's government 11 months ago."
"{u'main': u'CANADIAN EXODUS CAUSING CONCERN; Outflow to United States, Low Birth Rate and Small Influx of British Settlers Brings Proposal to Stabilize Employment'}","THE exodus of Canada's people to other countries and a declining birth rate are causing real concern in the Dominion. A young nation with ample territory and unmeasured natural resources, Canada is, nevertheless, developing those maladies peculiar...",https://query.nytimes.com/gst/abstract.html?res=9F05EFDC153CEE3ABC4A51DFB366838C639EDE,"THE exodus of Canada's people to other countries and a declining birth rate are causing real concern in the Dominion. A young nation with ample territory and unmeasured natural resources, Canada is, nevertheless, developing those maladies peculiar to nations past their prime."
"{u'main': u'CANADIAN EXODUS CAUSING CONCERN; Outflow to United States, Low Birth Rate and Small Influx of British Settlers Brings Proposal to Stabilize Employment'}","THE exodus of Canada's people to other countries and a declining birth rate are causing real concern in the Dominion. A young nation with ample territory and unmeasured natural resources, Canada is, nevertheless, developing those maladies peculiar...",https://query.nytimes.com/gst/abstract.html?res=9F05EFDC153CEE3ABC4A51DFB366838C639EDE,"THE exodus of Canada's people to other countries and a declining birth rate are causing real concern in the Dominion. A young nation with ample territory and unmeasured natural resources, Canada is, nevertheless, developing those maladies peculiar to nations past their prime."
"{u'seo': u'Oil Sands Project in Canada Will Go On if Pipeline Is Blocked', u'main': u'Oil Sands Project in Canada Will Go On if Pipeline Is Blocked', u'print_headline': u'Canada Prepares Plans B and C in Case Oil Sands Pipeline Hits a Roadblock'}","Oil producers in Canada have several alternatives for reaching the United States market, and a growing alternative market lies in China....",https://www.nytimes.com/2011/06/07/business/energy-environment/07pipeline.html,"Oil producers in Canada have several alternatives for reaching the United States market, and a growing alternative market lies in China."
"{u'seo': u'Tiny Canadian Town Can Play Hockey Year-Round With Synthetic Ice', u'main': u'Who Needs Ice? Synthetic Surface Extends Season', u'sub': u'New Rink Allows Town to Play Hockey Year-Round ;', u'print_headline': u'Who Needs Ice? Synthetic Surface Extends Season'}","Fort Chipewyan, Alberta, celebrated the recent opening of what manufacturers call the first full-size synthetic hockey rink in North America....",https://www.nytimes.com/2010/12/13/sports/hockey/13ice.html,"Fort Chipewyan, Alberta, celebrated the recent opening of what manufacturers call the first full-size synthetic hockey rink in North America."
{u'main': u'Canada Seeks Phone Rivalry'},"More than a decade after barriers to competition began to come down in Canada's telephone industry, politicians and regulators are venting their displeasure at how little has been accomplished.    In contrast to the United States, where AT&T was b...",https://www.nytimes.com/2003/04/22/business/canada-seeks-phone-rivalry.html,"More than a decade after barriers to competition began to come down in Canada's telephone industry, politicians and regulators are venting their displeasure at how little has been accomplished. In contrast to the United States, where AT&T was broken up long ago and curbs placed on the new regional operating companies, regulators in Canada have taken a softer approach, seeking to encourage competition without destabilizing the entrenched incumbents. The hope has been that new entrants would gain market share by building networks of their own, and, with some help from regulators, by gaining access to existing lines at reasonable cost."
{u'main': u'Flight To Canada; Canada'},"Reed, Ishmael: Flight to Canada revd by Jerome Charyn; Reed por...",https://query.nytimes.com/gst/abstract.html?res=9E00E3D9173DE034BC4152DFBF66838D669EDE,
"{u'main': u'U.S. Equestrian Team Wins Nations Cup Jumping at Harrisburg Horse Show; 3 AMERICANS GIVE FAULTLESS RIDES Canadian Team Finishes in Second Place Chile, Ireland Far Behind', u'kicker': u'1'}","HARRISBURG, Pa., Oct. 21 The strength and depth of the United States Equestrian Team brought victory tonight in the Nations Cup event in the Pennsylvania National Horse Show....",https://query.nytimes.com/gst/abstract.html?res=9D0DE6D9143CE43BBC4A51DFB667838D679EDE,"HARRISBURG, Pa., Oct. 21 The strength and depth of the United States Equestrian Team brought victory tonight in the Nations Cup event in the Pennsylvania National Horse Show."
"{u'main': u'New Nations: How They Came of Age; DEMOCRACY IN THE DOMINIONS. By Alexander Brady. 475 pp. Toronto, Canada: The University of Toronto Press. $4.25.'}","ONLY those who have taken on the task of trying to understand a nation other than their own will thoroughly appreciate the immense amount of work that has gone into Professor Brady's admirable comparative study of Canada, New Zealand, Australia an...",https://query.nytimes.com/gst/abstract.html?res=9C02E1DD113EEF33A25757C2A96E9C946693D6CF,"ONLY those who have taken on the task of trying to understand a nation other than their own will thoroughly appreciate the immense amount of work that has gone into Professor Brady's admirable comparative study of Canada, New Zealand, Australia and South Africa."
"{u'main': u""TRADE WITH CANADA.; WHAT MINISTER FOSTER SAYS OF THE M'KINLEY BILL.""}","OTTAWA, Ont., Sept. 13. -- The Hon. George E. Foster, Minister of Finance, speaking to a TIMES correspondent to-day regarding the effect of the McKinley bill on Canada, said: ""In the measure as it passed the Senate there is little that is calculat...",https://query.nytimes.com/gst/abstract.html?res=9C07EFDD1239E033A25757C1A96F9C94619ED7CF,"OTTAWA, Ont., Sept. 13. -- The Hon. George E. Foster, Minister of Finance, speaking to a TIMES correspondent to-day regarding the effect of the McKinley bill on Canada, said: ""In the measure as it passed the Senate there is little that is calculated to favor Canadian trade, while the general trend is in the line of prohibiting Canadian products from the American markets."
{u'main': u'The Militia of Canada.'},"A year ago we laid before our readers a summary, derived from official sources, of the numbers, equipment and general resources of the local military force of Canada. We have now before us the Provincial Militia Report for the past year, and a few...",https://www.nytimes.com/1864/03/20/news/the-militia-of-canada.html,"A year ago we laid before our readers a summary, derived from official sources, of the numbers, equipment and general resources of the local military force of Canada. We have now before us the Provincial Militia Report for the past year, and a few facts may be gathered from it, not altogether without interest."
"{u'main': u""Spring Morning in the Han Palace'; Stamps BRITISH PAINTERS FRANCE'S LE BRUN RENOIR RUSSIAN WORKS ETHOIPIAN TREASURES THAI TEMPLE MURALS CANADIAN ANNIVERSARY""}","A TREASURED Chinese handscroll of the Ming Dynasty is being reproduced for the second year on stamps from Nationalist China, and also on tap are enough art reproductions to fill a small gallery....",https://query.nytimes.com/gst/abstract.html?res=9502E2DB123DE63ABC4852DFB0668388669EDE,"A TREASURED Chinese handscroll of the Ming Dynasty is being reproduced for the second year on stamps from Nationalist China, and also on tap are enough art reproductions to fill a small gallery."
{u'main': u'Excerpts From Report to Canadian Government on Drug Use'},"OTTAWA, June 19 Following are excerpts from the final chapter, ""The Issues Some Interim Recommendations,"" of a report to the Government published today by the LeDain Commission on Canada's drug laws:...",https://query.nytimes.com/gst/abstract.html?res=9F03E7DF113EE034BC4851DFB066838B669EDE,"OTTAWA, June 19 Following are excerpts from the final chapter, ""The Issues Some Interim Recommendations,"" of a report to the Government published today by the LeDain Commission on Canada's drug laws:"
"{u'main': u'MOTORISTS DEMAND SAFETY IN NEW CARS; Clearer Vision and Danger Caused by Reflections From Shiny Ornaments Stressed UTILITARIAN AUTO IS IDEAL Wide Range of Advances Is Proposed by Drivers in 37 States, Mexico, Canada'}","A comprehensive cross-section of this country, with views from neighbor nations, was represented in the replies received by THE NEW YORK TIMES to a series of queries relative to post-war automobile body improvements presented between Nov. 26 and D...",https://query.nytimes.com/gst/abstract.html?res=9907E1DF1138E33BBC4950DFB467838F659EDE,"A comprehensive cross-section of this country, with views from neighbor nations, was represented in the replies received by THE NEW YORK TIMES to a series of queries relative to post-war automobile body improvements presented between Nov. 26 and Dec. 17, inclusive, at the request of the Society of Automotive Engineers."
{u'main': u'FLUCTUATIONS IN ANIMAL LIFE STUDIED FOR EFFECTS ON MAN; Cyclical Periods of Abundance and Scarcity Arouse Deep Speculation Among Natural Scientists Meeting in Canada Animals and Forests. Effect of the Fluctuations. Wild Mice in Labrador. When Mice Decrease. A Rabbit Disease.'},THIRTY scientists gathered recently in this remote corner of  North America to discuss animal populations....,https://query.nytimes.com/gst/abstract.html?res=9C05E7DE143DEE32A25753C3A96E9C946094D6CF,THIRTY scientists gathered recently in this remote corner of North America to discuss animal populations.
