headline,snippet,web_url,lead_paragraph
"{u'main': u""RECORDS SHOW MILDER WINTERS FOR CANADA; There Won't Be Any of All 234 Years From Now if Present. Tendency Continues.""}",Records show milder winters for Canada...,https://query.nytimes.com/gst/abstract.html?res=9C00E7DE143AEE3ABC4D52DFB466838A629EDE,
"{u'main': u'Canada to Phase Out Coal-Fired Electricity by 2030', u'print_headline': u'Canada to Phase Out Coal-Fired Electricity by 2030'}",Canada announced it plans phase out the use of coal-fired electricity by 2030. The move is in stark contrast to President-elect Donald Trump’s vow to revive the American coal industry....,https://www.nytimes.com/aponline/2016/11/21/world/ap-cn-canada-coal-phase-out.html,Canada announced it plans phase out the use of coal-fired electricity by 2030. The move is in stark contrast to President-elect Donald Trump’s vow to revive the American coal industry.
"{u'main': u'Canada, Climate and Trade', u'kicker': u'Green'}",Canada and the United States could be heading for a clash over energy exports....,https://green.blogs.nytimes.com/2009/12/18/canada-climate-and-trade/,"Regardless of the outcome of the climate talks in Copenhagen, Canada and the United States could be heading for a trade battle over energy exports, according to a prominent Canadian trade lawyer who recently returned from the Danish capital."
{u'main': u'INVESTING CLIMATE IN CANADA HAILED'},"MURRAY BAY, Que., June 17 (Canadian Press) -- The climate for saving and investing is better than it was a year ago, Norman J. Alexander, president of the Investment Dealers' Association of Canada, said today at the association's annual meeting....",https://query.nytimes.com/gst/abstract.html?res=9407E6DE143FE333A2575BC1A9609C946191D6CF,"MURRAY BAY, Que., June 17 (Canadian Press) -- The climate for saving and investing is better than it was a year ago, Norman J. Alexander, president of the Investment Dealers' Association of Canada, said today at the association's annual meeting."
"{u'main': u'Justin Trudeau, Canadian Prime Minister, Making Rare Official Visit', u'print_headline': u'Canadian Leader Making Rare State Visit'}",The first state visit by a Canadian leader in 19 years was made possible in part by new pledges of cooperation on combating climate change....,https://www.nytimes.com/2016/03/10/us/politics/canada-leader-justin-tredeau-obama-visit.html,The first state visit by a Canadian leader in 19 years was made possible in part by new pledges of cooperation on combating climate change.
"{u'main': u'Canada\u2019s New Leadership Reverses Course on Climate Change', u'print_headline': u' New Leadership Quickly Reverses Canada&#8217;s Position on Climate Change '}","The new prime minister, Justin Trudeau, has moved climate-change policy to the top of the country’s political agenda after it spent nearly a decade as an afterthought....",https://www.nytimes.com/2015/11/27/world/americas/canadas-new-leadership-reverses-course-on-climate-change.html,"The new prime minister, Justin Trudeau, has moved climate-change policy to the top of the country’s political agenda after it spent nearly a decade as an afterthought."
"{u'main': u'Canada: Pledge Sent to U.N. to Reduce Greenhouse Gas Emissions by 2030', u'print_headline': u'The Americas; Canada: Pledge Sent to U.N. to Reduce Greenhouse Gas Emissions by 2030', u'content_kicker': u'World Briefing'}",Prime Minister Stephen Harper’s government said Friday that Canada would reduce greenhouse gas emissions by 30 percent below 2005 levels by 2030....,https://www.nytimes.com/2015/05/16/world/americas/canada-pledge-sent-to-un-to-reduce-greenhouse-gas-emissions-by-2030.html,Prime Minister Stephen Harper’s government said Friday that Canada would reduce greenhouse gas emissions by 30 percent below 2005 levels by 2030.
"{u'main': u'In Canada, TV Goes Deep on Climate', u'kicker': u'Dot Earth'}","A rare thing: five hours of television on climate modeling, science, politics, media coverage and more....",https://dotearth.blogs.nytimes.com/2010/03/26/in-canada-tv-goes-deep-on-climate/,"In a world of shrinking conventional coverage of (non-medical) science and the environment, it was refreshing recently to become aware of the The Agenda with Steve Paikin, a popular current-affairs program on public television in Ontario -- particularly its five-hour string of shows devoted to some of the prime facets of the climate challenge."
"{u'main': u'Canada\u2019s Trudeau Steps Up on Climate Change', u'kicker': u'Editorial', u'print_headline': u'Canada Steps Up on Climate Change', u'content_kicker': u'Editorial'}","The prime minister’s plan to put a price on carbon emissions is a significant environmental step, and leaves provinces with choices on how to carry it out....",https://www.nytimes.com/2016/10/07/opinion/canadas-trudeau-steps-up-on-climate-change.html,"The prime minister’s plan to put a price on carbon emissions is a significant environmental step, and leaves provinces with choices on how to carry it out."
"{u'seo': u'Canada Leaving Kyoto Protocol on Climate Change', u'main': u'Canada Announces Exit From Kyoto Climate Treaty', u'print_headline': u'Canada Announces Exit From Kyoto Climate Treaty'}","In announcing the decision, government officials indicated that the possibility of huge fines for Canada’s failure to meet greenhouse gas emissions targets had played a role....",https://www.nytimes.com/2011/12/13/science/earth/canada-leaving-kyoto-protocol-on-climate-change.html,"In announcing the decision, government officials indicated that the possibility of huge fines for Canada’s failure to meet greenhouse gas emissions targets had played a role."
"{u'main': u""TAX FREE BONDS AN EVIL?; What the Government Loses In Taxes and Gains in Interest. Early Birds. THE COLOMBIAN TREATY Result of an Inquiry Into the Attitude of Mr. Harding Regarding It. NEW BALTIC STATES. Recognition by the Allies Defended --Rumania and Poland Criticised. Help for China. ONLY 40 BELOW ZERO. Canadian Northwest Doesn't Mind Little Touch of Winter. WAGES OVER 700 YEARS. Have Risen From 3 Cents a Day in 1250 to $5 in 1920.""}",quotes W Hardy's table of wages in England from 1250 to 1920...,https://query.nytimes.com/gst/abstract.html?res=9806EFDD1631EF33A25751C0A9649C946095D6CF,
"{u'main': u'Climate Changes Mean Canada to Spend More on Disasters-Insurers', u'print_headline': u'Climate Changes Mean Canada to Spend More on Disasters-Insurers'}","Canada will have to set aside more money to deal with natural disasters like wildfires, storms and floods as climate change starts to bite, the head of the country's property insurance industry group said on Wednesday....",https://www.nytimes.com/reuters/2016/05/18/us/18reuters-canada-wildfire-climatechange.html,"Canada will have to set aside more money to deal with natural disasters like wildfires, storms and floods as climate change starts to bite, the head of the country's property insurance industry group said on Wednesday."
"{u'main': u'Trudeau, Canadian Provinces Set for Tough Climate Change Talks', u'print_headline': u'Trudeau, Canadian Provinces Set for Tough Climate Change Talks'}","Canadian Prime Minister Justin Trudeau faces a challenging day of climate change talks on Thursday with leaders of the country's 10 provinces, one of whom opposes a key part of Ottawa's plan to cut greenhouse gas emissions....",https://www.nytimes.com/reuters/2016/02/29/world/americas/29reuters-canada-climatechange.html,"Canadian Prime Minister Justin Trudeau faces a challenging day of climate change talks on Thursday with leaders of the country's 10 provinces, one of whom opposes a key part of Ottawa's plan to cut greenhouse gas emissions."
{u'main': u'Sniper Attacks on Doctors Create Climate of Fear in Canada'},"For many Canadian doctors who perform abortions, it has become a grim mid-autumn ritual. They pull their drapes at night and wear bulletproof vests to the office. They are told to drive different cars and change the spots they park in from day to ...",https://www.nytimes.com/1998/10/29/nyregion/sniper-attacks-on-doctors-create-climate-of-fear-in-canada.html,"For many Canadian doctors who perform abortions, it has become a grim mid-autumn ritual. They pull their drapes at night and wear bulletproof vests to the office. They are told to drive different cars and change the spots they park in from day to day. Some even schedule their vacations for the first two weeks of November. The doctors in this part of Canada have been aware of the danger since Nov. 10, 1995. A gunman standing in the rain in a wooded ravine behind the Tudor home of Dr. Hugh Short here, about an hour's drive from Niagara Falls, fired a shot from a high-powered hunting rifle through the kitchen window, shattering his elbow and ending his career at 62."
"{u'main': u'Canada Ratifies Paris Climate Change Deal in Boost for Trudeau', u'print_headline': u'Canada Ratifies Paris Climate Change Deal in Boost for Trudeau'}","Canada's Parliament on Wednesday ratified the Paris agreement to curb climate-warming emissions, bolstering Prime Minister Justin Trudeau's bid to tackle climate change after a decade of inaction by the previous government....",https://www.nytimes.com/reuters/2016/10/05/world/americas/05reuters-climatechange-canada.html,"Canada's Parliament on Wednesday ratified the Paris agreement to curb climate-warming emissions, bolstering Prime Minister Justin Trudeau's bid to tackle climate change after a decade of inaction by the previous government."
{u'main': u'Canadian Lawmakers Advance Climate Pact as Discord Grows'},"The House of Commons voted overwhelmingly to ratify the Kyoto climate change protocol today, but widespread disapproval by powerful provincial governments and business groups has called into question whether the agreement will ever be fully put in...",https://www.nytimes.com/2002/12/11/world/canadian-lawmakers-advance-climate-pact-as-discord-grows.html,"The House of Commons voted overwhelmingly to ratify the Kyoto climate change protocol today, but widespread disapproval by powerful provincial governments and business groups has called into question whether the agreement will ever be fully put in place in Canada. Proponents said Canada's ratification was a major step forward for the 1997 treaty. Canada, one of the world's largest producers of carbon dioxide emissions per capita, is one of only a few large polluting countries among about 100 nations to have ratified or moved toward ratification."
"{u'main': u'Obama, Trudeau Mark Better Canada Ties With Climate, Trade Accords', u'print_headline': u'Obama, Trudeau Mark Better Canada Ties With Climate, Trade Accords'}",President Barack Obama and new Canadian Prime Minister Justin Trudeau on Thursday ended a frosty period in bilateral ties by agreeing to tackle climate change and strive to settle a long-lasting trade dispute over Canadian softwood lumber exports....,https://www.nytimes.com/reuters/2016/03/10/us/politics/10reuters-usa-canada.html,President Barack Obama and new Canadian Prime Minister Justin Trudeau on Thursday ended a frosty period in bilateral ties by agreeing to tackle climate change and strive to settle a long-lasting trade dispute over Canadian softwood lumber exports.
{u'main': u'No-Confidence Vote in Canada Threatens U.N. Climate Change Meeting'},"On the same day Canada is to play host to a crucial environmental conference, Prime Minister Paul Martin's Liberal Party government is expected to fall in a no-confidence vote....",https://www.nytimes.com/2005/11/27/international/americas/27canada.html,"Monday was supposed to be the day Canada took the reins of international environmental leadership, playing host to a United Nations climate change conference in Montreal to begin a critical round of negotiations to decide how the world will confront global warming in the coming decades. But now Monday is also the day that Prime Minister Paul Martin's Liberal Party government is expected to fall in a no-confidence vote in the House of Commons. Many of the Canadian cabinet ministers and other members of Parliament who were supposed to attend the conference will now be scurrying to the campaign trail instead."
{u'main': u'A Flow of Cool Canadian Cash Helps the Economic Climate'},"TORONTO--It is entirely possible today that some average New York businessman works in a Manhattan skyscraper owned by Canadians, uses office forms printed by Canadians, grabs lunch in a restaurant owned by Canadians, buys a novel in a Canadian-ow...",https://query.nytimes.com/gst/abstract.html?res=9D00E4DC1F31E432A25754C0A9649D94619FD6CF,"TORONTO--It is entirely possible today that some average New York businessman works in a Manhattan skyscraper owned by Canadians, uses office forms printed by Canadians, grabs lunch in a restaurant owned by Canadians, buys a novel in a Canadian-owned bookstore and rides to and from work in a rail car made by Canadians and powered by electricity from Canada."
"{u'main': u'On Our Radar: Is Canada Retreating From Climate Action?', u'kicker': u'Green'}",A round-up of environmental news....,https://green.blogs.nytimes.com/2012/11/27/on-our-radar-is-canada-retreating-from-climate-action/,
"{u'main': u'Obama, Justin Trudeau and Enrique Pe\xf1a Nieto Focus on Climate, Both Political and Global', u'print_headline': u'Canada Summit Meeting Focuses on Climate, Both Political and Global'}","The three North American leaders met in Ottawa, focusing on climate change and the ripples from Britain’s vote, and disavowed nativist political currents....",https://www.nytimes.com/2016/06/30/world/americas/obama-justin-trudeau-canada-mexico.html,"The three North American leaders met in Ottawa, focusing on climate change and the ripples from Britain’s vote, and disavowed nativist political currents."
"{u'seo': u'Outdoor Skating, a Joy of Winter in Canada, Feels Effects of Changing Climate', u'main': u'Outdoor Skating, Winter\u2019s Joy in Canada, Feels Effects of Changing Climate', u'print_headline': u'Outdoor Skating, Winter&#8217;s Joy in Canada, Feels Effects of Changing Climate'}","This winter on a canal in Ottawa, the weather allowed only 28 skating days, which approached the record for the shortest season: 26 days, set in 2002....",https://www.nytimes.com/2012/03/18/sports/outdoor-skating-a-joy-of-winter-in-canada-feels-effects-of-changing-climate.html,"This winter on a canal in Ottawa, the weather allowed only 28 skating days, which approached the record for the shortest season: 26 days, set in 2002."
"{u'content_kicker': u'Havens | Naramata, British Columbia', u'main': u'A Sandy Beach, a Sunny Climate and Canadian Wine', u'kicker': u'Havens | Naramata, British Columbia', u'print_headline': u'A Sandy Beach, a Sunny Climate and Canadian Wine', u'sub': u'The Scene ;'}","Vineyards, orchards and great weather are luring second-home buyers to Naramata, a British Columbia village 50 miles north of the United States border....",https://www.nytimes.com/2007/04/27/realestate/greathomes/27havens_ready.html,"Vineyards, orchards and great weather are luring second-home buyers to Naramata, a British Columbia village 50 miles north of the United States border."
"{u'main': u""Canada to Tell World It's Serious About Climate Change, Says PM"", u'print_headline': u""Canada to Tell World It's Serious About Climate Change, Says PM""}","Canada will tell a green summit next week that it is finally ready to tackle climate change, Prime Minister Justin Trudeau said on Monday after a meeting with the country's provinces to work out a national strategy....",https://www.nytimes.com/reuters/2015/11/23/world/americas/23reuters-climatechange-summit-canada.html,"Canada will tell a green summit next week that it is finally ready to tackle climate change, Prime Minister Justin Trudeau said on Monday after a meeting with the country's provinces to work out a national strategy."
"{u'main': u'On Keystone and Climate, Bloomberg Presses Obama to Negotiate with Canada Instead of Congress', u'kicker': u'Dot Earth'}",Former Mayor Bloomberg presses Obama to bypass Keystone gridlock by seeking climate progress in Canada....,https://dotearth.blogs.nytimes.com/2015/02/25/on-keystone-and-climate-bloomberg-presses-obama-to-negotiate-with-canada-instead-of-congress/,
"{u'main': u""Of Alberta's Oil Sands and 'Harmonizing' Canadian and U.S. Climate Policy"", u'kicker': u'Green'}","In the run-up to December's global climate change meeting in Copenhagen, fissures are emerging between Canada and the United States over how to deal with the internationally contentious issue of Alberta's vast oil sands projects....",https://green.blogs.nytimes.com/2009/10/26/of-albertas-oil-sands-and-harmonizing-canadian-and-us-climate-policy/,"In the run-up to December's global climate change meeting, fissures are emerging between Canada and the United States over how to deal with the internationally contentious issue of Alberta's vast oil sands projects, which have been responsible for a sharp increase in Canada's greenhouse gas emissions."
"{u'main': u'White House Says Canada Could Do More on Climate Ahead of Paris Talks', u'print_headline': u'White House Says Canada Could Do More on Climate Ahead of Paris Talks'}","The White House said on Tuesday the new Canadian government could do more to address climate change ahead of international negotiations on the issue next month in Paris, a top priority for President Barack Obama in his 15 months remaining in offic...",https://www.nytimes.com/reuters/2015/10/20/us/politics/20reuters-canada-election-whitehouse.html,"The White House said on Tuesday the new Canadian government could do more to address climate change ahead of international negotiations on the issue next month in Paris, a top priority for President Barack Obama in his 15 months remaining in office."
"{u'main': u""Head of Canadian Truce Observers Leaves Saigon; A Wrong Impression The Right Climate' Replacement Sought Big Clash Near Saigon""}","Michel Gauvin, head of the Canadian delegation to the International Commission of Control and Supervision, left Saigon today after having struggled for nearly six months to make the commission an effective peace-keeping organization....",https://query.nytimes.com/gst/abstract.html?res=9403E2DB133DE63ABC4851DFB1668388669EDE,"Michel Gauvin, head of the Canadian delegation to the International Commission of Control and Supervision, left Saigon today after having struggled for nearly six months to make the commission an effective peace-keeping organization."
"{u'main': u'For a Canadian Province, Gas Boom Presents a Conundrum', u'kicker': u'Green Column', u'print_headline': u'Gas Boom May Upend British Columbia Climate Policies', u'content_kicker': u'Green Column'}","When no drilling boom was in sight, British Columbia instituted aggressive climate change policies, but now there are plans to build 13 plants to export natural gas to Asia....",https://www.nytimes.com/2014/05/29/business/energy-environment/for-british-columbia-gas-boom-presents-a-conundrum.html,"When no drilling boom was in sight, British Columbia instituted aggressive climate change policies, but now there are plans to build 13 plants to export natural gas to Asia."
{u'main': u'SAFETY DECREASE IN PLANE IS DENIED; Trans-Canada and Designer of Viscount Lay Changes to American Climate'},"MONTREAL, Dec. 13 (Canadian Press) -- The designer and buyer of a new British airliner said today ""the various modifications made for Trans-Canada Air Lines were almost without exception,"" to insure reliable operations under North American climate...",https://query.nytimes.com/gst/abstract.html?res=9403E2D9173CE03ABC4C52DFB467838F649EDE,"MONTREAL, Dec. 13 (Canadian Press) -- The designer and buyer of a new British airliner said today ""the various modifications made for Trans-Canada Air Lines were almost without exception,"" to insure reliable operations under North American climate conditions."
"{u'main': u""CANADA.; The Soil and Climate of Red River-An Expedition by Way of Hudson Bay The Purchase of the Company's Claims-Welland Canal-Pilot-Boat Lost."", u'kicker': u'1'}","In the Senate Committee on the North-west Territory, Dr. SCHULTZ, the Canadian who recently escaped from Fort Garry, was examined at considerable length in regard to the climate, resources. , of the Red River Territory....",https://query.nytimes.com/gst/abstract.html?res=9406E3DA143BE63BBC4951DFB266838B669FDE,"In the Senate Committee on the North-west Territory, Dr. SCHULTZ, the Canadian who recently escaped from Fort Garry, was examined at considerable length in regard to the climate, resources. , of the Red River Territory."
{u'main': u'AFTER CANADIAN TRADE; Fur Manufacturers Watching Development in the Northwest. Immense Trade in Fur Coats in Prospect -- An Article of Necessity in the Canadian Climate -- American Trade Statistics.'},"""The time is coming, and it is not so far off, either,"" said a large importer of furs the other day, ""when our American manufacturers of furs will invade the Canadian market. Many men in the trade agree that this will happen eventually, but I thin...",https://query.nytimes.com/gst/abstract.html?res=9505EFD61039E333A25750C1A9649D946297D6CF,"""The time is coming, and it is not so far off, either,"" said a large importer of furs the other day, ""when our American manufacturers of furs will invade the Canadian market. Many men in the trade agree that this will happen eventually, but I think that it is coming much faster than many of them imagine."
"{u'main': u""Memories of 1970 Quebec Crisis Raised in Canada Charter Debate; Climate of Fear Recalled Use of Referendums Proposed Denounced as 'Loaded Dice'""}","OTTAWA, Oct. 10--The federal Parliament is debating the constitutional future of Canada just 10 years after one of the most dramatic moments of its history, the Quebec crisis of October 1970, when a handful of extreme nationalists resorted to kidn...",https://query.nytimes.com/gst/abstract.html?res=9B05E2DA1631E732A25752C1A9669D94619FD6CF,"OTTAWA, Oct. 10--The federal Parliament is debating the constitutional future of Canada just 10 years after one of the most dramatic moments of its history, the Quebec crisis of October 1970, when a handful of extreme nationalists resorted to kidnapping and murder to promote independence for the province."
"{u'main': u'REPORTS A NEW PORT FORMED IN THE YUKON; Dominion Engineer Says Climate Has Broken Up Ice Bed, Letting Glacier Bay Into Canada.'}",Says changing climate in Yukon territory makes formation of new ocean port with direct access to sea possible...,https://query.nytimes.com/gst/abstract.html?res=9E00EFDE1339EF32A25756C0A96E9C946495D6CF,
"{u'main': u""NON-BRITISH WHISKY JUST ISN'T, THEY SAY; Six Distillers Sue in Berlin to Prevent German Calling His Product by the Name. HOLD CLIMATE ESSENTIAL Renown of Bourbon and Monongahela, Not to Mention Canadian Sorts, Is Disregarded in Suit.""}","BERLIN, Feb. 4 (AP). -- The contention that real whisky cannot be made anywhere outside the British Isles was made in a Berlin court today....",https://query.nytimes.com/gst/abstract.html?res=980DEEDA113EE333A25756C0A9649C946394D6CF,"BERLIN, Feb. 4 (AP). -- The contention that real whisky cannot be made anywhere outside the British Isles was made in a Berlin court today."
"{u'main': u'TO INSURE AGAINST DROUGHT, A VAST PLAN TAKES SHAPE; The Program for a Belt of Trees Reaching From Canada to Texas Envisages Modification of the Climate of the Great Plains'}","AT the very time when the drought-stricken States of the Middle West are more than ever focusing national attention, a gigantic drought-relief project is being launched by the United States Forest Service -- a forest shelterbelt 100 miles wide and...",https://query.nytimes.com/gst/abstract.html?res=9E0DE3DD1339E33ABC4151DFB166838F629EDE,"AT the very time when the drought-stricken States of the Middle West are more than ever focusing national attention, a gigantic drought-relief project is being launched by the United States Forest Service -- a forest shelterbelt 100 miles wide and extending more than 1,000 miles across the Great Plains from the Canadian border to Texas."
{u'main': u'SOVIET FARMING SEEN IN TROUBLE; Desire for Wheat Supplies Indicates Virtual Chaos in Russian System MANY QUESTIONS RAISED International Ramifications of Deal With Canada May Be Far-Reaching Climate Varies SOVIET FARMING SEEN IN TROUBLE Canadians Happy Shipment Stages'},"Sir Winston Churchill once described Russia in a memorable speech as a ""riddle wrapped in a mystery inside an enigma.""...",https://query.nytimes.com/gst/abstract.html?res=9C03E5D71F31E63ABC4A51DFBF668388679EDE,"Sir Winston Churchill once described Russia in a memorable speech as a ""riddle wrapped in a mystery inside an enigma."""
"{u'main': u'U.S.-CANADA TIES MAY BE WIDENED; Talk of Economic Union is Heard--Climate Set by Huge Sales of Grain Arguments Stronger U.S.-CANADA TIES MAY BE WIDENED Issue Is Tackled Tariff Walls Rising Austerity Ruled Out', u'kicker': u'2'}",Probably the most important and controversial subject confronting Canadian-American relations today is slowly being discussed in larger and larger groups--economic union of the two countries....,https://query.nytimes.com/gst/abstract.html?res=9E07E6D7133CEF3BBC4B52DFB6678388679EDE,Probably the most important and controversial subject confronting Canadian-American relations today is slowly being discussed in larger and larger groups--economic union of the two countries.
